id_persona,clave_sobrevivencia,nombre,sexo,clase_viaje,id_bote,id_cuerpo,edad,cantidad_parientes,cantidad_familiares,acompañantes,rango_edad,sobrevivencia,clase,acompañada
10000,0,"Andrews, Mr. Thomas Jr",HOMBRE,1,,,39.0,0,0,0,MEDIANA EDAD,MURIÓ,PRIMERA CLASE,SOLA
10001,0,"Chisholm, Mr. Roderick Robert Crispin",HOMBRE,1,,,,0,0,0,,MURIÓ,PRIMERA CLASE,SOLA
10002,0,"Fry, Mr. Richard",HOMBRE,1,,,,0,0,0,,MURIÓ,PRIMERA CLASE,SOLA
10003,0,"Harrison, Mr. William",HOMBRE,1,,110.0,40.0,0,0,0,MEDIANA EDAD,MURIÓ,PRIMERA CLASE,SOLA
10004,1,"Ismay, Mr. Joseph Bruce",HOMBRE,1,C,,49.0,0,0,0,ADULTOS MAYORES,VIVIÓ,PRIMERA CLASE,SOLA
10005,0,"Parr, Mr. William Henry Marsh",HOMBRE,1,,,,0,0,0,,MURIÓ,PRIMERA CLASE,SOLA
10006,0,"Reuchlin, Jonkheer. John George",HOMBRE,1,,,38.0,0,0,0,MEDIANA EDAD,MURIÓ,PRIMERA CLASE,SOLA
10007,0,"Carlsson, Mr. Frans Olof",HOMBRE,1,,,33.0,0,0,0,ADULTOS,MURIÓ,PRIMERA CLASE,SOLA
10008,0,"Colley, Mr. Edward Pomeroy",HOMBRE,1,,,47.0,0,0,0,ADULTOS MAYORES,MURIÓ,PRIMERA CLASE,SOLA
10009,1,"Cornell, Mrs. Robert Clifford (Malvina Helen Lamson)",MUJER,1,2,,55.0,2,0,2,ADULTOS MAYORES,VIVIÓ,PRIMERA CLASE,ACOMPAÑADA
10010,1,"Omont, Mr. Alfred Fernand",HOMBRE,1,7,,,0,0,0,,VIVIÓ,PRIMERA CLASE,SOLA
10011,1,"Leader, Dr. Alice (Farnham)",MUJER,1,8,,49.0,0,0,0,ADULTOS MAYORES,VIVIÓ,PRIMERA CLASE,SOLA
10012,1,"Swift, Mrs. Frederick Joel (Margaret Welles Barron)",MUJER,1,8,,48.0,0,0,0,ADULTOS MAYORES,VIVIÓ,PRIMERA CLASE,SOLA
10013,0,"Birnbaum, Mr. Jakob",HOMBRE,1,,148.0,25.0,0,0,0,ADULTOS,MURIÓ,PRIMERA CLASE,SOLA
10014,0,"Case, Mr. Howard Brown",HOMBRE,1,,,49.0,0,0,0,ADULTOS MAYORES,MURIÓ,PRIMERA CLASE,SOLA
10015,0,"Jones, Mr. Charles Cresson",HOMBRE,1,,80.0,46.0,0,0,0,ADULTOS MAYORES,MURIÓ,PRIMERA CLASE,SOLA
10016,0,"Julian, Mr. Henry Forbes",HOMBRE,1,,,50.0,0,0,0,ADULTOS MAYORES,MURIÓ,PRIMERA CLASE,SOLA
10017,0,"Maguire, Mr. John Edward",HOMBRE,1,,,30.0,0,0,0,ADULTOS,MURIÓ,PRIMERA CLASE,SOLA
10018,0,"Nicholson, Mr. Arthur Ernest",HOMBRE,1,,263.0,64.0,0,0,0,ADULTOS MAYORES,MURIÓ,PRIMERA CLASE,SOLA
10019,1,"Salomon, Mr. Abraham L",HOMBRE,1,1,,,0,0,0,,VIVIÓ,PRIMERA CLASE,SOLA
10020,0,"Smith, Mr. Richard William",HOMBRE,1,,,,0,0,0,,MURIÓ,PRIMERA CLASE,SOLA
10021,1,"Newsom, Miss. Helen Monypeny",MUJER,1,5,,19.0,0,2,2,JOVENES,VIVIÓ,PRIMERA CLASE,ACOMPAÑADA
10022,1,"Calderhead, Mr. Edward Pennington",HOMBRE,1,5,,42.0,0,0,0,MEDIANA EDAD,VIVIÓ,PRIMERA CLASE,SOLA
10023,1,"Mcgough, Mr. James Robert",HOMBRE,1,7,,36.0,0,0,0,MEDIANA EDAD,VIVIÓ,PRIMERA CLASE,SOLA
10024,1,"Silverthorne, Mr. Spencer Victor",HOMBRE,1,5,,35.0,0,0,0,MEDIANA EDAD,VIVIÓ,PRIMERA CLASE,SOLA
10025,1,"Flynn, Mr. John Irwin (""Irving"")",HOMBRE,1,5,,36.0,0,0,0,MEDIANA EDAD,VIVIÓ,PRIMERA CLASE,SOLA
10026,1,"Anderson, Mr. Harry",HOMBRE,1,3,,48.0,0,0,0,ADULTOS MAYORES,VIVIÓ,PRIMERA CLASE,SOLA
10027,1,"Bjornstrom-Steffansson, Mr. Mauritz Hakan",HOMBRE,1,D,,28.0,0,0,0,ADULTOS,VIVIÓ,PRIMERA CLASE,SOLA
10028,1,"Bonnell, Miss. Elizabeth",MUJER,1,8,,58.0,0,0,0,ADULTOS MAYORES,VIVIÓ,PRIMERA CLASE,SOLA
10029,0,"Borebank, Mr. John James",HOMBRE,1,,,42.0,0,0,0,MEDIANA EDAD,MURIÓ,PRIMERA CLASE,SOLA
10030,1,"Bradley, Mr. George (""George Arthur Brayton"")",HOMBRE,1,9,,,0,0,0,,VIVIÓ,PRIMERA CLASE,SOLA
10031,0,"Butt, Major. Archibald Willingham",HOMBRE,1,,,45.0,0,0,0,ADULTOS MAYORES,MURIÓ,PRIMERA CLASE,SOLA
10032,0,"Crafton, Mr. John Bertram",HOMBRE,1,,,,0,0,0,,MURIÓ,PRIMERA CLASE,SOLA
10033,1,"Crosby, Mrs. Edward Gifford (Catherine Elizabeth Halstead)",MUJER,1,7,,64.0,1,1,2,ADULTOS MAYORES,VIVIÓ,PRIMERA CLASE,ACOMPAÑADA
10034,1,"Daly, Mr. Peter Denis ",HOMBRE,1,5 9,,51.0,0,0,0,ADULTOS MAYORES,VIVIÓ,PRIMERA CLASE,SOLA
10035,0,"Franklin, Mr. Thomas Parham",HOMBRE,1,,,,0,0,0,,MURIÓ,PRIMERA CLASE,SOLA
10036,1,"Homer, Mr. Harry (""Mr E Haven"")",HOMBRE,1,15,,35.0,0,0,0,MEDIANA EDAD,VIVIÓ,PRIMERA CLASE,SOLA
10037,0,"Klaber, Mr. Herman",HOMBRE,1,,,,0,0,0,,MURIÓ,PRIMERA CLASE,SOLA
10038,0,"Lindeberg-Lind, Mr. Erik Gustaf (""Mr Edward Lingrey"")",HOMBRE,1,,,42.0,0,0,0,MEDIANA EDAD,MURIÓ,PRIMERA CLASE,SOLA
10039,0,"Millet, Mr. Francis Davis",HOMBRE,1,,249.0,65.0,0,0,0,ADULTOS MAYORES,MURIÓ,PRIMERA CLASE,SOLA
10040,1,"Romaine, Mr. Charles Hallace (""Mr C Rolmane"")",HOMBRE,1,9,,45.0,0,0,0,ADULTOS MAYORES,VIVIÓ,PRIMERA CLASE,SOLA
10041,0,"Rowe, Mr. Alfred G",HOMBRE,1,,109.0,33.0,0,0,0,ADULTOS,MURIÓ,PRIMERA CLASE,SOLA
10042,1,"Seward, Mr. Frederic Kimber",HOMBRE,1,7,,34.0,0,0,0,ADULTOS,VIVIÓ,PRIMERA CLASE,SOLA
10043,0,"Smart, Mr. John Montgomery",HOMBRE,1,,,56.0,0,0,0,ADULTOS MAYORES,MURIÓ,PRIMERA CLASE,SOLA
10044,0,"Stead, Mr. William Thomas",HOMBRE,1,,,62.0,0,0,0,ADULTOS MAYORES,MURIÓ,PRIMERA CLASE,SOLA
10045,0,"Weir, Col. John",HOMBRE,1,,,60.0,0,0,0,ADULTOS MAYORES,MURIÓ,PRIMERA CLASE,SOLA
10046,1,"Willard, Miss. Constance",MUJER,1,8 10,,21.0,0,0,0,ADULTOS,VIVIÓ,PRIMERA CLASE,SOLA
10047,0,"Wright, Mr. George",HOMBRE,1,,,62.0,0,0,0,ADULTOS MAYORES,MURIÓ,PRIMERA CLASE,SOLA
10048,1,"Candee, Mrs. Edward (Helen Churchill Hungerford)",MUJER,1,6,,53.0,0,0,0,ADULTOS MAYORES,VIVIÓ,PRIMERA CLASE,SOLA
10049,1,"Brown, Mrs. James Joseph (Margaret Tobin)",MUJER,1,6,,44.0,0,0,0,MEDIANA EDAD,VIVIÓ,PRIMERA CLASE,SOLA
10050,1,"Cassebeer, Mrs. Henry Arthur Jr (Eleanor Genevieve Fosdick)",MUJER,1,5,,,0,0,0,,VIVIÓ,PRIMERA CLASE,SOLA
10051,1,"Frauenthal, Mr. Isaac Gerald",HOMBRE,1,5,,43.0,1,0,1,MEDIANA EDAD,VIVIÓ,PRIMERA CLASE,ACOMPAÑADA
10052,0,"Lewy, Mr. Ervin G",HOMBRE,1,,,,0,0,0,,MURIÓ,PRIMERA CLASE,SOLA
10053,1,"Lindstrom, Mrs. Carl Johan (Sigrid Posse)",MUJER,1,6,,55.0,0,0,0,ADULTOS MAYORES,VIVIÓ,PRIMERA CLASE,SOLA
10054,0,"Ovies Y Rodriguez, Mr. Servando",HOMBRE,1,,189.0,28.5,0,0,0,ADULTOS,MURIÓ,PRIMERA CLASE,SOLA
10055,1,"Rosenbaum, Miss. Edith Louise",MUJER,1,11,,33.0,0,0,0,ADULTOS,VIVIÓ,PRIMERA CLASE,SOLA
10056,0,"Stewart, Mr. Albert A",HOMBRE,1,,,,0,0,0,,MURIÓ,PRIMERA CLASE,SOLA
10057,0,"Uruchurtu, Don. Manuel E",HOMBRE,1,,,40.0,0,0,0,MEDIANA EDAD,MURIÓ,PRIMERA CLASE,SOLA
10058,0,"Foreman, Mr. Benjamin Laventall",HOMBRE,1,,,30.0,0,0,0,ADULTOS,MURIÓ,PRIMERA CLASE,SOLA
10059,1,"Gracie, Col. Archibald Iv",HOMBRE,1,B,,53.0,0,0,0,ADULTOS MAYORES,VIVIÓ,PRIMERA CLASE,SOLA
10060,0,"Partner, Mr. Austen",HOMBRE,1,,166.0,45.5,0,0,0,ADULTOS MAYORES,MURIÓ,PRIMERA CLASE,SOLA
10061,1,"Tucker, Mr. Gilbert Milligan Jr",HOMBRE,1,7,,31.0,0,0,0,ADULTOS,VIVIÓ,PRIMERA CLASE,SOLA
10062,0,"Isham, Miss. Ann Elizabeth",MUJER,1,,,50.0,0,0,0,ADULTOS MAYORES,MURIÓ,PRIMERA CLASE,SOLA
10063,1,"Chevre, Mr. Paul Romaine",HOMBRE,1,7,,45.0,0,0,0,ADULTOS MAYORES,VIVIÓ,PRIMERA CLASE,SOLA
10064,0,"Dulles, Mr. William Crothers",HOMBRE,1,,133.0,39.0,0,0,0,MEDIANA EDAD,MURIÓ,PRIMERA CLASE,SOLA
10065,0,"Kent, Mr. Edward Austin",HOMBRE,1,,258.0,58.0,0,0,0,ADULTOS MAYORES,MURIÓ,PRIMERA CLASE,SOLA
10066,1,"Marechal, Mr. Pierre",HOMBRE,1,7,,,0,0,0,,VIVIÓ,PRIMERA CLASE,SOLA
10067,0,"Natsch, Mr. Charles H",HOMBRE,1,,,37.0,0,1,1,MEDIANA EDAD,MURIÓ,PRIMERA CLASE,ACOMPAÑADA
10068,1,"Barkworth, Mr. Algernon Henry Wilson",HOMBRE,1,B,,80.0,0,0,0,ADULTOS MAYORES,VIVIÓ,PRIMERA CLASE,SOLA
10069,1,"Behr, Mr. Karl Howell",HOMBRE,1,5,,26.0,0,0,0,ADULTOS,VIVIÓ,PRIMERA CLASE,SOLA
10070,1,"Graham, Miss. Margaret Edith",MUJER,1,3,,19.0,0,0,0,JOVENES,VIVIÓ,PRIMERA CLASE,SOLA
10071,1,"Hawksford, Mr. Walter James",HOMBRE,1,3,,,0,0,0,,VIVIÓ,PRIMERA CLASE,SOLA
10072,0,"Long, Mr. Milton Clyde",HOMBRE,1,,126.0,29.0,0,0,0,ADULTOS,MURIÓ,PRIMERA CLASE,SOLA
10073,0,"Brady, Mr. John Bertram",HOMBRE,1,,,41.0,0,0,0,MEDIANA EDAD,MURIÓ,PRIMERA CLASE,SOLA
10074,1,"Daniel, Mr. Robert Williams",HOMBRE,1,3,,27.0,0,0,0,ADULTOS,VIVIÓ,PRIMERA CLASE,SOLA
10075,0,"Molson, Mr. Harry Markland",HOMBRE,1,,,55.0,0,0,0,ADULTOS MAYORES,MURIÓ,PRIMERA CLASE,SOLA
10076,1,"Peuchen, Major. Arthur Godfrey",HOMBRE,1,6,,52.0,0,0,0,ADULTOS MAYORES,VIVIÓ,PRIMERA CLASE,SOLA
10077,1,"Saalfeld, Mr. Adolphe",HOMBRE,1,3,,,0,0,0,,VIVIÓ,PRIMERA CLASE,SOLA
10078,1,"Stahelin-Maeglin, Dr. Max",HOMBRE,1,3,,32.0,0,0,0,ADULTOS,VIVIÓ,PRIMERA CLASE,SOLA
10079,0,"Hoyt, Mr. William Fisher",HOMBRE,1,14,,,0,0,0,,MURIÓ,PRIMERA CLASE,SOLA
10080,0,"Smith, Mr. James Clinch",HOMBRE,1,,,56.0,0,0,0,ADULTOS MAYORES,MURIÓ,PRIMERA CLASE,SOLA
10081,1,"Blank, Mr. Henry",HOMBRE,1,7,,40.0,0,0,0,MEDIANA EDAD,VIVIÓ,PRIMERA CLASE,SOLA
10082,0,"Cairns, Mr. Alexander",HOMBRE,1,,,,0,0,0,,MURIÓ,PRIMERA CLASE,SOLA
10083,1,"Serepeca, Miss. Augusta",MUJER,1,4,,30.0,0,0,0,ADULTOS,VIVIÓ,PRIMERA CLASE,SOLA
10084,0,"Evans, Miss. Edith Corse",MUJER,1,,,36.0,0,0,0,MEDIANA EDAD,MURIÓ,PRIMERA CLASE,SOLA
10085,1,"Flegenheim, Mrs. Alfred (Antoinette)",MUJER,1,7,,,0,0,0,,VIVIÓ,PRIMERA CLASE,SOLA
10086,0,"Sutton, Mr. Frederick",HOMBRE,1,,46.0,61.0,0,0,0,ADULTOS MAYORES,MURIÓ,PRIMERA CLASE,SOLA
10087,0,"Van Der Hoef, Mr. Wyckoff",HOMBRE,1,,245.0,61.0,0,0,0,ADULTOS MAYORES,MURIÓ,PRIMERA CLASE,SOLA
10088,0,"Walker, Mr. William Anderson",HOMBRE,1,,,47.0,0,0,0,ADULTOS MAYORES,MURIÓ,PRIMERA CLASE,SOLA
10089,0,"Goldschmidt, Mr. George B",HOMBRE,1,,,71.0,0,0,0,ADULTOS MAYORES,MURIÓ,PRIMERA CLASE,SOLA
10090,0,"Williams-Lambert, Mr. Fletcher Fellows",HOMBRE,1,,,,0,0,0,,MURIÓ,PRIMERA CLASE,SOLA
10091,1,"Simonius-Blumer, Col. Oberst Alfons",HOMBRE,1,3,,56.0,0,0,0,ADULTOS MAYORES,VIVIÓ,PRIMERA CLASE,SOLA
10092,1,"Sloper, Mr. William Thompson",HOMBRE,1,7,,28.0,0,0,0,ADULTOS,VIVIÓ,PRIMERA CLASE,SOLA
10093,1,"Woolner, Mr. Hugh",HOMBRE,1,D,,,0,0,0,,VIVIÓ,PRIMERA CLASE,SOLA
10094,0,"Gee, Mr. Arthur H",HOMBRE,1,,275.0,47.0,0,0,0,ADULTOS MAYORES,MURIÓ,PRIMERA CLASE,SOLA
10095,1,"Lines, Miss. Mary Conover",MUJER,1,9,,16.0,0,1,1,JOVENES,VIVIÓ,PRIMERA CLASE,ACOMPAÑADA
10096,1,"Lines, Mrs. Ernest H (Elizabeth Lindsey James)",MUJER,1,9,,51.0,0,1,1,ADULTOS MAYORES,VIVIÓ,PRIMERA CLASE,ACOMPAÑADA
10097,0,"Brewe, Dr. Arthur Jackson",HOMBRE,1,,,,0,0,0,,MURIÓ,PRIMERA CLASE,SOLA
10098,1,"Duff Gordon, Lady. (Lucille Christiana Sutherland) (""Mrs Morgan"")",MUJER,1,1,,48.0,1,0,1,ADULTOS MAYORES,VIVIÓ,PRIMERA CLASE,ACOMPAÑADA
10099,1,"Rheims, Mr. George Alexander Lucien",HOMBRE,1,A,,,0,0,0,,VIVIÓ,PRIMERA CLASE,SOLA
10100,0,"Ross, Mr. John Hugo",HOMBRE,1,,,36.0,0,0,0,MEDIANA EDAD,MURIÓ,PRIMERA CLASE,SOLA
10101,0,"Harrington, Mr. Charles H",HOMBRE,1,,,,0,0,0,,MURIÓ,PRIMERA CLASE,SOLA
10102,0,"Moore, Mr. Clarence Bloomfield",HOMBRE,1,,,47.0,0,0,0,ADULTOS MAYORES,MURIÓ,PRIMERA CLASE,SOLA
10103,0,"Head, Mr. Christopher",HOMBRE,1,,,42.0,0,0,0,MEDIANA EDAD,MURIÓ,PRIMERA CLASE,SOLA
10104,0,"Loring, Mr. Joseph Holland",HOMBRE,1,,,30.0,0,0,0,ADULTOS,MURIÓ,PRIMERA CLASE,SOLA
10105,0,"Carrau, Mr. Francisco M",HOMBRE,1,,,28.0,0,0,0,ADULTOS,MURIÓ,PRIMERA CLASE,SOLA
10106,0,"Carrau, Mr. Jose Pedro",HOMBRE,1,,,17.0,0,0,0,JOVENES,MURIÓ,PRIMERA CLASE,SOLA
10107,1,"Frolicher, Miss. Hedwig Margaritha",MUJER,1,5,,22.0,0,2,2,ADULTOS,VIVIÓ,PRIMERA CLASE,ACOMPAÑADA
10108,,"Artagaveytia, Mr. Ramon",HOMBRE,1,,22.0,71.0,0,0,0,ADULTOS MAYORES,,PRIMERA CLASE,SOLA
10109,1,"Mayne, Mlle. Berthe Antonine (""Mrs De Villiers"")",MUJER,1,6,,24.0,0,0,0,ADULTOS,VIVIÓ,PRIMERA CLASE,SOLA
10110,0,"Hipkins, Mr. William Edward",HOMBRE,1,,,55.0,0,0,0,ADULTOS MAYORES,MURIÓ,PRIMERA CLASE,SOLA
10111,0,"Rood, Mr. Hugh Roscoe",HOMBRE,1,,,,0,0,0,,MURIÓ,PRIMERA CLASE,SOLA
10112,0,"Brandeis, Mr. Emil",HOMBRE,1,,208.0,48.0,0,0,0,ADULTOS MAYORES,MURIÓ,PRIMERA CLASE,SOLA
10113,0,"Roebling, Mr. Washington Augustus Ii",HOMBRE,1,,,31.0,0,0,0,ADULTOS,MURIÓ,PRIMERA CLASE,SOLA
10114,1,"Appleton, Mrs. Edward Dale (Charlotte Lamson)",MUJER,1,D,,53.0,2,0,2,ADULTOS MAYORES,VIVIÓ,PRIMERA CLASE,ACOMPAÑADA
10115,1,"Brown, Mrs. John Murray (Caroline Lane Lamson)",MUJER,1,D,,59.0,2,0,2,ADULTOS MAYORES,VIVIÓ,PRIMERA CLASE,ACOMPAÑADA
10116,0,"Hilliard, Mr. Herbert Henry",HOMBRE,1,,,,0,0,0,,MURIÓ,PRIMERA CLASE,SOLA
10117,0,"Kenyon, Mr. Frederick R",HOMBRE,1,,,41.0,1,0,1,MEDIANA EDAD,MURIÓ,PRIMERA CLASE,ACOMPAÑADA
10118,1,"Kenyon, Mrs. Frederick R (Marion)",MUJER,1,8,,,1,0,1,,VIVIÓ,PRIMERA CLASE,ACOMPAÑADA
10119,0,"Mccarthy, Mr. Timothy J",HOMBRE,1,,175.0,54.0,0,0,0,ADULTOS MAYORES,MURIÓ,PRIMERA CLASE,SOLA
10120,0,"Clifford, Mr. George Quincy",HOMBRE,1,,,,0,0,0,,MURIÓ,PRIMERA CLASE,SOLA
10121,0,"Davidson, Mr. Thornton",HOMBRE,1,,,31.0,1,0,1,ADULTOS,MURIÓ,PRIMERA CLASE,ACOMPAÑADA
10122,1,"Davidson, Mrs. Thornton (Orian Hays)",MUJER,1,3,,27.0,1,2,3,ADULTOS,VIVIÓ,PRIMERA CLASE,ACOMPAÑADA
10123,0,"Holverson, Mr. Alexander Oskar",HOMBRE,1,,38.0,42.0,1,0,1,MEDIANA EDAD,MURIÓ,PRIMERA CLASE,ACOMPAÑADA
10124,1,"Holverson, Mrs. Alexander Oskar (Mary Aline Towner)",MUJER,1,8,,35.0,1,0,1,MEDIANA EDAD,VIVIÓ,PRIMERA CLASE,ACOMPAÑADA
10125,0,"Porter, Mr. Walter Chamberlain",HOMBRE,1,,207.0,47.0,0,0,0,ADULTOS MAYORES,MURIÓ,PRIMERA CLASE,SOLA
10126,1,"Taylor, Mr. Elmer Zebley",HOMBRE,1,5 7,,48.0,1,0,1,ADULTOS MAYORES,VIVIÓ,PRIMERA CLASE,ACOMPAÑADA
10127,1,"Taylor, Mrs. Elmer Zebley (Juliet Cummins Wright)",MUJER,1,5 7,,,1,0,1,,VIVIÓ,PRIMERA CLASE,ACOMPAÑADA
10128,1,"Beckwith, Mr. Richard Leonard",HOMBRE,1,5,,37.0,1,1,2,MEDIANA EDAD,VIVIÓ,PRIMERA CLASE,ACOMPAÑADA
10129,1,"Beckwith, Mrs. Richard Leonard (Sallie Monypeny)",MUJER,1,5,,47.0,1,1,2,ADULTOS MAYORES,VIVIÓ,PRIMERA CLASE,ACOMPAÑADA
10130,1,"Kimball, Mr. Edwin Nelson Jr",HOMBRE,1,5,,42.0,1,0,1,MEDIANA EDAD,VIVIÓ,PRIMERA CLASE,ACOMPAÑADA
10131,1,"Kimball, Mrs. Edwin Nelson Jr (Gertrude Parsons)",MUJER,1,5,,45.0,1,0,1,ADULTOS MAYORES,VIVIÓ,PRIMERA CLASE,ACOMPAÑADA
10132,1,"Chambers, Mr. Norman Campbell",HOMBRE,1,5,,27.0,1,0,1,ADULTOS,VIVIÓ,PRIMERA CLASE,ACOMPAÑADA
10133,1,"Chambers, Mrs. Norman Campbell (Bertha Griggs)",MUJER,1,5,,33.0,1,0,1,ADULTOS,VIVIÓ,PRIMERA CLASE,ACOMPAÑADA
10134,0,"Futrelle, Mr. Jacques Heath",HOMBRE,1,,,37.0,1,0,1,MEDIANA EDAD,MURIÓ,PRIMERA CLASE,ACOMPAÑADA
10135,1,"Futrelle, Mrs. Jacques Heath (Lily May Peel)",MUJER,1,D,,35.0,1,0,1,MEDIANA EDAD,VIVIÓ,PRIMERA CLASE,ACOMPAÑADA
10136,0,"Marvin, Mr. Daniel Warner",HOMBRE,1,,,19.0,1,0,1,JOVENES,MURIÓ,PRIMERA CLASE,ACOMPAÑADA
10137,1,"Marvin, Mrs. Daniel Warner (Mary Graham Carmichael Farquarson)",MUJER,1,10,,18.0,1,0,1,JOVENES,VIVIÓ,PRIMERA CLASE,ACOMPAÑADA
10138,1,"Bowerman, Miss. Elsie Edith",MUJER,1,6,,22.0,0,1,1,ADULTOS,VIVIÓ,PRIMERA CLASE,ACOMPAÑADA
10139,1,"Chibnall, Mrs. (Edith Martha Bowerman)",MUJER,1,6,,,0,1,1,,VIVIÓ,PRIMERA CLASE,ACOMPAÑADA
10140,1,"Harder, Mr. George Achilles",HOMBRE,1,5,,25.0,1,0,1,ADULTOS,VIVIÓ,PRIMERA CLASE,ACOMPAÑADA
10141,1,"Harder, Mrs. George Achilles (Dorothy Annan)",MUJER,1,5,,25.0,1,0,1,ADULTOS,VIVIÓ,PRIMERA CLASE,ACOMPAÑADA
10142,1,"Stengel, Mr. Charles Emil Henry",HOMBRE,1,1,,54.0,1,0,1,ADULTOS MAYORES,VIVIÓ,PRIMERA CLASE,ACOMPAÑADA
10143,1,"Stengel, Mrs. Charles Emil Henry (Annie May Morris)",MUJER,1,5,,43.0,1,0,1,MEDIANA EDAD,VIVIÓ,PRIMERA CLASE,ACOMPAÑADA
10144,0,"Silvey, Mr. William Baird",HOMBRE,1,,,50.0,1,0,1,ADULTOS MAYORES,MURIÓ,PRIMERA CLASE,ACOMPAÑADA
10145,1,"Silvey, Mrs. William Baird (Alice Munger)",MUJER,1,11,,39.0,1,0,1,MEDIANA EDAD,VIVIÓ,PRIMERA CLASE,ACOMPAÑADA
10146,1,"Duff Gordon, Sir. Cosmo Edmund (""Mr Morgan"")",HOMBRE,1,1,,49.0,1,0,1,ADULTOS MAYORES,VIVIÓ,PRIMERA CLASE,ACOMPAÑADA
10147,1,"Francatelli, Miss. Laura Mabel",MUJER,1,1,,30.0,0,0,0,ADULTOS,VIVIÓ,PRIMERA CLASE,SOLA
10148,1,"Dick, Mr. Albert Adrian",,1,3,,31.0,1,0,1,ADULTOS,VIVIÓ,PRIMERA CLASE,ACOMPAÑADA
10149,1,"Dick, Mrs. Albert Adrian (Vera Gillespie)",MUJER,1,3,,17.0,1,0,1,JOVENES,VIVIÓ,PRIMERA CLASE,ACOMPAÑADA
10150,1,"Mock, Mr. Philipp Edmund",HOMBRE,1,11,,30.0,1,0,1,ADULTOS,VIVIÓ,PRIMERA CLASE,ACOMPAÑADA
10151,1,"Schabert, Mrs. Paul (Emma Mock)",MUJER,1,11,,35.0,1,0,1,MEDIANA EDAD,VIVIÓ,PRIMERA CLASE,ACOMPAÑADA
10152,1,"Hippach, Miss. Jean Gertrude",MUJER,1,4,,16.0,0,1,1,JOVENES,VIVIÓ,PRIMERA CLASE,ACOMPAÑADA
10153,1,"Hippach, Mrs. Louis Albert (Ida Sophia Fischer)",MUJER,1,4,,44.0,0,1,1,MEDIANA EDAD,VIVIÓ,PRIMERA CLASE,ACOMPAÑADA
10154,1,"Gibson, Miss. Dorothy Winifred",MUJER,1,7,,22.0,0,1,1,ADULTOS,VIVIÓ,PRIMERA CLASE,ACOMPAÑADA
10155,1,"Gibson, Mrs. Leonard (Pauline C Boeson)",MUJER,1,7,,45.0,0,1,1,ADULTOS MAYORES,VIVIÓ,PRIMERA CLASE,ACOMPAÑADA
10156,0,"Rothschild, Mr. Martin",HOMBRE,1,,,55.0,1,0,1,ADULTOS MAYORES,MURIÓ,PRIMERA CLASE,ACOMPAÑADA
10157,1,"Rothschild, Mrs. Martin (Elizabeth L. Barrett)",MUJER,1,6,,54.0,1,0,1,ADULTOS MAYORES,VIVIÓ,PRIMERA CLASE,ACOMPAÑADA
10158,0,"Smith, Mr. Lucien Philip",HOMBRE,1,,,24.0,1,0,1,ADULTOS,MURIÓ,PRIMERA CLASE,ACOMPAÑADA
10159,1,"Smith, Mrs. Lucien Philip (Mary Eloise Hughes)",MUJER,1,6,,18.0,1,0,1,JOVENES,VIVIÓ,PRIMERA CLASE,ACOMPAÑADA
10160,0,"Chaffee, Mr. Herbert Fuller",HOMBRE,1,,,46.0,1,0,1,ADULTOS MAYORES,MURIÓ,PRIMERA CLASE,ACOMPAÑADA
10161,1,"Chaffee, Mrs. Herbert Fuller (Carrie Constance Toogood)",MUJER,1,4,,47.0,1,0,1,ADULTOS MAYORES,VIVIÓ,PRIMERA CLASE,ACOMPAÑADA
10162,0,"Williams, Mr. Charles Duane",HOMBRE,1,,,51.0,0,1,1,ADULTOS MAYORES,MURIÓ,PRIMERA CLASE,ACOMPAÑADA
10163,1,"Williams, Mr. Richard Norris Ii",HOMBRE,1,A,,21.0,0,1,1,ADULTOS,VIVIÓ,PRIMERA CLASE,ACOMPAÑADA
10164,1,"Ostby, Miss. Helene Ragnhild",MUJER,1,5,,22.0,0,1,1,ADULTOS,VIVIÓ,PRIMERA CLASE,ACOMPAÑADA
10165,0,"Ostby, Mr. Engelhart Cornelius",HOMBRE,1,,234.0,65.0,0,1,1,ADULTOS MAYORES,MURIÓ,PRIMERA CLASE,ACOMPAÑADA
10166,1,"Greenfield, Mr. William Bertram",HOMBRE,1,7,,23.0,0,1,1,ADULTOS,VIVIÓ,PRIMERA CLASE,ACOMPAÑADA
10167,1,"Greenfield, Mrs. Leo David (Blanche Strouse)",MUJER,1,7,,45.0,0,1,1,ADULTOS MAYORES,VIVIÓ,PRIMERA CLASE,ACOMPAÑADA
10168,0,"Pears, Mr. Thomas Clinton",HOMBRE,1,,,29.0,1,0,1,ADULTOS,MURIÓ,PRIMERA CLASE,ACOMPAÑADA
10169,1,"Pears, Mrs. Thomas (Edith Wearne)",MUJER,1,8,,22.0,1,0,1,ADULTOS,VIVIÓ,PRIMERA CLASE,ACOMPAÑADA
10170,1,"Aubart, Mme. Leontine Pauline",MUJER,1,9,,24.0,0,0,0,ADULTOS,VIVIÓ,PRIMERA CLASE,SOLA
10171,1,"Sagesser, Mlle. Emma",MUJER,1,9,,24.0,0,0,0,ADULTOS,VIVIÓ,PRIMERA CLASE,SOLA
10172,0,"Crosby, Capt. Edward Gifford",HOMBRE,1,,269.0,70.0,1,1,2,ADULTOS MAYORES,MURIÓ,PRIMERA CLASE,ACOMPAÑADA
10173,1,"Crosby, Miss. Harriet R",MUJER,1,7,,36.0,0,2,2,MEDIANA EDAD,VIVIÓ,PRIMERA CLASE,ACOMPAÑADA
10174,0,"Cumings, Mr. John Bradley",HOMBRE,1,,,39.0,1,0,1,MEDIANA EDAD,MURIÓ,PRIMERA CLASE,ACOMPAÑADA
10175,1,"Cumings, Mrs. John Bradley (Florence Briggs Thayer)",MUJER,1,4,,38.0,1,0,1,MEDIANA EDAD,VIVIÓ,PRIMERA CLASE,ACOMPAÑADA
10176,0,"Beattie, Mr. Thomson",HOMBRE,1,A,,36.0,0,0,0,MEDIANA EDAD,MURIÓ,PRIMERA CLASE,SOLA
10177,0,"Mccaffry, Mr. Thomas Francis",HOMBRE,1,,292.0,46.0,0,0,0,ADULTOS MAYORES,MURIÓ,PRIMERA CLASE,SOLA
10178,0,"Warren, Mr. Frank Manley",HOMBRE,1,,,64.0,1,0,1,ADULTOS MAYORES,MURIÓ,PRIMERA CLASE,ACOMPAÑADA
10179,1,"Warren, Mrs. Frank Manley (Anna Sophia Atkinson)",MUJER,1,5,,60.0,1,0,1,ADULTOS MAYORES,VIVIÓ,PRIMERA CLASE,ACOMPAÑADA
10180,1,"Bazzani, Miss. Albina",MUJER,1,8,,32.0,0,0,0,ADULTOS,VIVIÓ,PRIMERA CLASE,SOLA
10181,1,"Bucknell, Mrs. William Robert (Emma Eliza Ward)",MUJER,1,8,,60.0,0,0,0,ADULTOS MAYORES,VIVIÓ,PRIMERA CLASE,SOLA
10182,1,"Harper, Mr. Henry Sleeper",HOMBRE,1,3,,48.0,1,0,1,ADULTOS MAYORES,VIVIÓ,PRIMERA CLASE,ACOMPAÑADA
10183,1,"Harper, Mrs. Henry Sleeper (Myna Haxtun)",MUJER,1,3,,49.0,1,0,1,ADULTOS MAYORES,VIVIÓ,PRIMERA CLASE,ACOMPAÑADA
10184,1,"Hassab, Mr. Hammad",HOMBRE,1,3,,27.0,0,0,0,ADULTOS,VIVIÓ,PRIMERA CLASE,SOLA
10185,0,"White, Mr. Percival Wayland",HOMBRE,1,,,54.0,0,1,1,ADULTOS MAYORES,MURIÓ,PRIMERA CLASE,ACOMPAÑADA
10186,0,"White, Mr. Richard Frasar",HOMBRE,1,,169.0,21.0,0,1,1,ADULTOS,MURIÓ,PRIMERA CLASE,ACOMPAÑADA
10187,1,"Andrews, Miss. Kornelia Theodosia",MUJER,1,10,,63.0,1,0,1,ADULTOS MAYORES,VIVIÓ,PRIMERA CLASE,ACOMPAÑADA
10188,1,"Hogeboom, Mrs. John C (Anna Andrews)",MUJER,1,10,,51.0,1,0,1,ADULTOS MAYORES,VIVIÓ,PRIMERA CLASE,ACOMPAÑADA
10189,1,"Longley, Miss. Gretchen Fiske",MUJER,1,10,,21.0,0,0,0,ADULTOS,VIVIÓ,PRIMERA CLASE,SOLA
10190,1,"Eustis, Miss. Elizabeth Mussey",MUJER,1,4,,54.0,1,0,1,ADULTOS MAYORES,VIVIÓ,PRIMERA CLASE,ACOMPAÑADA
10191,1,"Stephenson, Mrs. Walter Bertram (Martha Eustis)",MUJER,1,4,,52.0,1,0,1,ADULTOS MAYORES,VIVIÓ,PRIMERA CLASE,ACOMPAÑADA
10192,1,"Barber, Miss. Ellen ""Nellie""",MUJER,1,6,,26.0,0,0,0,ADULTOS,VIVIÓ,PRIMERA CLASE,SOLA
10193,0,"Cavendish, Mr. Tyrell William",HOMBRE,1,,172.0,36.0,1,0,1,MEDIANA EDAD,MURIÓ,PRIMERA CLASE,ACOMPAÑADA
10194,1,"Cavendish, Mrs. Tyrell William (Julia Florence Siegel)",MUJER,1,6,,76.0,1,0,1,ADULTOS MAYORES,VIVIÓ,PRIMERA CLASE,ACOMPAÑADA
10195,1,"Frolicher-Stehli, Mr. Maxmillian",HOMBRE,1,5,,60.0,1,1,2,ADULTOS MAYORES,VIVIÓ,PRIMERA CLASE,ACOMPAÑADA
10196,1,"Frolicher-Stehli, Mrs. Maxmillian (Margaretha Emerentia Stehli)",MUJER,1,5,,48.0,1,1,2,ADULTOS MAYORES,VIVIÓ,PRIMERA CLASE,ACOMPAÑADA
10197,0,"Giglio, Mr. Victor",HOMBRE,1,,,24.0,0,0,0,ADULTOS,MURIÓ,PRIMERA CLASE,SOLA
10198,0,"Guggenheim, Mr. Benjamin",HOMBRE,1,,,46.0,0,0,0,ADULTOS MAYORES,MURIÓ,PRIMERA CLASE,SOLA
10199,0,"Rosenshine, Mr. George (""Mr George Thorne"")",HOMBRE,1,,16.0,46.0,0,0,0,ADULTOS MAYORES,MURIÓ,PRIMERA CLASE,SOLA
10200,1,"Thorne, Mrs. Gertrude Maybelle",MUJER,1,D,,,0,0,0,,VIVIÓ,PRIMERA CLASE,SOLA
10201,1,"Taussig, Miss. Ruth",MUJER,1,8,,18.0,0,2,2,JOVENES,VIVIÓ,PRIMERA CLASE,ACOMPAÑADA
10202,0,"Taussig, Mr. Emil",HOMBRE,1,,,52.0,1,1,2,ADULTOS MAYORES,MURIÓ,PRIMERA CLASE,ACOMPAÑADA
10203,1,"Taussig, Mrs. Emil (Tillie Mandelbaum)",MUJER,1,8,,39.0,1,1,2,MEDIANA EDAD,VIVIÓ,PRIMERA CLASE,ACOMPAÑADA
10204,1,"Icard, Miss. Amelie",MUJER,1,6,,38.0,0,0,0,MEDIANA EDAD,VIVIÓ,PRIMERA CLASE,SOLA
10205,1,"Stone, Mrs. George Nelson (Martha Evelyn)",MUJER,1,6,,62.0,0,0,0,ADULTOS MAYORES,VIVIÓ,PRIMERA CLASE,SOLA
10206,1,"Dodge, Dr. Washington",HOMBRE,1,13,,53.0,1,1,2,ADULTOS MAYORES,VIVIÓ,PRIMERA CLASE,ACOMPAÑADA
10207,1,"Dodge, Master. Washington",HOMBRE,1,5,,4.0,0,2,2,INFANTES,VIVIÓ,PRIMERA CLASE,ACOMPAÑADA
10208,1,"Dodge, Mrs. Washington (Ruth Vidaver)",MUJER,1,5,,54.0,1,1,2,ADULTOS MAYORES,VIVIÓ,PRIMERA CLASE,ACOMPAÑADA
10209,0,"Meyer, Mr. Edgar Joseph",HOMBRE,1,,,28.0,1,0,1,ADULTOS,MURIÓ,PRIMERA CLASE,ACOMPAÑADA
10210,1,"Meyer, Mrs. Edgar Joseph (Leila Saks)",MUJER,1,6,,,1,0,1,,VIVIÓ,PRIMERA CLASE,ACOMPAÑADA
10211,1,"Snyder, Mr. John Pillsbury",HOMBRE,1,7,,24.0,1,0,1,ADULTOS,VIVIÓ,PRIMERA CLASE,ACOMPAÑADA
10212,1,"Snyder, Mrs. John Pillsbury (Nelle Stevenson)",MUJER,1,7,,23.0,1,0,1,ADULTOS,VIVIÓ,PRIMERA CLASE,ACOMPAÑADA
10213,1,"Compton, Miss. Sara Rebecca",MUJER,1,14,,39.0,1,1,2,MEDIANA EDAD,VIVIÓ,PRIMERA CLASE,ACOMPAÑADA
10214,0,"Compton, Mr. Alexander Taylor Jr",HOMBRE,1,,,37.0,1,1,2,MEDIANA EDAD,MURIÓ,PRIMERA CLASE,ACOMPAÑADA
10215,1,"Compton, Mrs. Alexander Taylor (Mary Eliza Ingersoll)",MUJER,1,14,,64.0,0,2,2,ADULTOS MAYORES,VIVIÓ,PRIMERA CLASE,ACOMPAÑADA
10216,1,"Earnshaw, Mrs. Boulton (Olive Potter)",MUJER,1,7,,23.0,0,1,1,ADULTOS,VIVIÓ,PRIMERA CLASE,ACOMPAÑADA
10217,1,"Hays, Miss. Margaret Bechstein",MUJER,1,7,,24.0,0,0,0,ADULTOS,VIVIÓ,PRIMERA CLASE,SOLA
10218,1,"Potter, Mrs. Thomas Jr (Lily Alexenia Wilson)",MUJER,1,7,,56.0,0,1,1,ADULTOS MAYORES,VIVIÓ,PRIMERA CLASE,ACOMPAÑADA
10219,0,"Harris, Mr. Henry Birkhardt",HOMBRE,1,,,45.0,1,0,1,ADULTOS MAYORES,MURIÓ,PRIMERA CLASE,ACOMPAÑADA
10220,1,"Harris, Mrs. Henry Birkhardt (Irene Wallach)",MUJER,1,D,,35.0,1,0,1,MEDIANA EDAD,VIVIÓ,PRIMERA CLASE,ACOMPAÑADA
10221,1,"Cherry, Miss. Gladys",MUJER,1,8,,30.0,0,0,0,ADULTOS,VIVIÓ,PRIMERA CLASE,SOLA
10222,1,"Maioni, Miss. Roberta",MUJER,1,8,,16.0,0,0,0,JOVENES,VIVIÓ,PRIMERA CLASE,SOLA
10223,1,"Rothes, The Countess. Of (Lucy Noel Martha Dyer-Edwards)",MUJER,1,8,,33.0,0,0,0,ADULTOS,VIVIÓ,PRIMERA CLASE,SOLA
10224,1,"Goldenberg, Mr. Samuel L",HOMBRE,1,5,,49.0,1,0,1,ADULTOS MAYORES,VIVIÓ,PRIMERA CLASE,ACOMPAÑADA
10225,1,"Goldenberg, Mrs. Samuel L (Edwiga Grabowska)",MUJER,1,5,,,1,0,1,,VIVIÓ,PRIMERA CLASE,ACOMPAÑADA
10226,1,"Hoyt, Mr. Frederick Maxfield",HOMBRE,1,D,,38.0,1,0,1,MEDIANA EDAD,VIVIÓ,PRIMERA CLASE,ACOMPAÑADA
10227,1,"Hoyt, Mrs. Frederick Maxfield (Jane Anne Forby)",MUJER,1,D,,35.0,1,0,1,MEDIANA EDAD,VIVIÓ,PRIMERA CLASE,ACOMPAÑADA
10228,0,"Minahan, Dr. William Edward",HOMBRE,1,,230.0,44.0,2,0,2,MEDIANA EDAD,MURIÓ,PRIMERA CLASE,ACOMPAÑADA
10229,1,"Minahan, Miss. Daisy E",MUJER,1,14,,33.0,1,0,1,ADULTOS,VIVIÓ,PRIMERA CLASE,ACOMPAÑADA
10230,1,"Minahan, Mrs. William Edward (Lillian E Thorpe)",MUJER,1,14,,37.0,1,0,1,MEDIANA EDAD,VIVIÓ,PRIMERA CLASE,ACOMPAÑADA
10231,1,"Bishop, Mr. Dickinson H",HOMBRE,1,7,,25.0,1,0,1,ADULTOS,VIVIÓ,PRIMERA CLASE,ACOMPAÑADA
10232,1,"Bishop, Mrs. Dickinson H (Helen Walton)",MUJER,1,7,,19.0,1,0,1,JOVENES,VIVIÓ,PRIMERA CLASE,ACOMPAÑADA
10233,0,"Hays, Mr. Charles Melville",HOMBRE,1,,307.0,55.0,1,1,2,ADULTOS MAYORES,MURIÓ,PRIMERA CLASE,ACOMPAÑADA
10234,1,"Hays, Mrs. Charles Melville (Clara Jennings Gregg)",MUJER,1,3,,52.0,1,1,2,ADULTOS MAYORES,VIVIÓ,PRIMERA CLASE,ACOMPAÑADA
10235,0,"Payne, Mr. Vivian Ponsonby",HOMBRE,1,,,23.0,0,0,0,ADULTOS,MURIÓ,PRIMERA CLASE,SOLA
10236,1,"Perreault, Miss. Anne",MUJER,1,3,,30.0,0,0,0,ADULTOS,VIVIÓ,PRIMERA CLASE,SOLA
10237,0,"Douglas, Mr. Walter Donald",,1,,62.0,50.0,1,0,1,ADULTOS MAYORES,MURIÓ,PRIMERA CLASE,ACOMPAÑADA
10238,1,"Douglas, Mrs. Walter Donald (Mahala Dutton)",MUJER,1,2,,48.0,1,0,1,ADULTOS MAYORES,VIVIÓ,PRIMERA CLASE,ACOMPAÑADA
10239,1,"Leroy, Miss. Bertha",MUJER,1,2,,30.0,0,0,0,ADULTOS,VIVIÓ,PRIMERA CLASE,SOLA
10240,1,"Oliva Y Ocana, Dona. Fermina",MUJER,1,8,,39.0,0,0,0,MEDIANA EDAD,VIVIÓ,PRIMERA CLASE,SOLA
10241,0,"Penasco Y Castellana, Mr. Victor De Satode",HOMBRE,1,,,18.0,1,0,1,JOVENES,MURIÓ,PRIMERA CLASE,ACOMPAÑADA
10242,1,"Penasco Y Castellana, Mrs. Victor De Satode (Maria Josefa Perez De Soto Y Vallejo)",MUJER,1,8,,17.0,1,0,1,JOVENES,VIVIÓ,PRIMERA CLASE,ACOMPAÑADA
10243,1,"Fleming, Miss. Margaret",MUJER,1,4,,,0,0,0,,VIVIÓ,PRIMERA CLASE,SOLA
